<?xml version="1.0" encoding="UTF-8"?>
<xs:schema xmlns:xs="http://www.w3.org/2001/XMLSchema">

  <!-- gá»‘c: <thuvien> -->
  <xs:element name="thuvien">
    <xs:complexType>
      <xs:sequence>
        <xs:element name="sach" maxOccurs="unbounded">
          <xs:complexType>
            <xs:sequence>
              <xs:element name="title" type="xs:string"/>
              <xs:element name="author" type="xs:string"/>
              <xs:element name="year" type="xs:gYear"/>
              <xs:element name="genre" type="xs:string"/>
            </xs:sequence>
            <xs:attribute name="id" type="xs:ID" use="required"/>
          </xs:complexType>
        </xs:element>
      </xs:sequence>
    </xs:complexType>
  </xs:element>

</xs:schema>
